{
  "version": "2026-04-15-play-gate-v1",
  "updatedAt": "2026-04-16",
  "decisionStates": [
    "ship",
    "ship-with-backlog",
    "do-not-ship"
  ],
  "failureStates": [
    "config_drift",
    "preconditions_not_met"
  ],
  "preconditions": [
    {
      "id": "PRE-1",
      "name": "es5-clean-fire-os-only",
      "description": "ES5 compliance check applies ONLY to Fire OS ambient surfaces (TheSpine, TheSoul). Education surfaces on Surface Pro 5 and S10 FE are modern-JS-tier — ES5 check is not run for them.",
      "scope": "fire-os-ambient",
      "measurement_method": "grep -n 'const \\|let \\|=>\\|`' TheSpine.html TheSoul.html",
      "failure_action": "emit preconditions_not_met and abort run"
    },
    {
      "id": "PRE-2",
      "name": "failure-handler-coverage",
      "description": "Every google.script.run.<fn>Safe() call has a matching .withFailureHandler() that is non-empty (not function(){}).",
      "scope": "all-play-surfaces",
      "measurement_method": "grep -n 'withFailureHandler(function(){}\\|withFailureHandler(function() {})' <surface.html>",
      "failure_action": "emit preconditions_not_met and abort run"
    },
    {
      "id": "PRE-3",
      "name": "theme-palette-declared",
      "description": "Sparkle Kingdom (JJ) or Wolfdome (Buggsy) palette hex values in surface CSS match the canonical registry at ops/themes/palettes.md.",
      "scope": "all-play-surfaces",
      "measurement_method": "Extract --bg-primary and key brand hex from surface CSS; assert match against palettes.md entry for the surface's theme",
      "failure_action": "emit preconditions_not_met and abort run"
    },
    {
      "id": "PRE-4",
      "name": "safe-wrapper-chain-intact",
      "description": "Every server-call chain uses a Safe wrapper function. No direct non-Safe delegation to module functions.",
      "scope": "all-play-surfaces",
      "measurement_method": "grep -n 'google.script.run\\.' <surface.html> | assert all callee names end in 'Safe'",
      "failure_action": "emit preconditions_not_met and abort run"
    }
  ],
  "criteria": {
    "universalMustPass": [
      {
        "id": "U1",
        "name": "correct-device",
        "description": "Test at the mapped viewport for the real device profile. If the device profile is ambiguous or missing from ops/surface-map.md, the run fails as config_drift.",
        "tier": "universal-must-pass",
        "surface_family": "all",
        "threshold": "Viewport matches device profile in ops/surface-map.md; config_drift if missing",
        "measurement_method": "Assert Playwright viewport equals device profile viewport. Cross-check ops/surface-map.md Device column for the route being tested.",
        "evidence_type": "screenshot",
        "failure_mode": "critical",
        "owner": "platform-owner",
        "source": "ops/surface-map.md device profiles; ops/play-gate-rubric.v1.json deviceProfiles"
      },
      {
        "id": "U2",
        "name": "loads-cleanly",
        "description": "Route returns 200, no blank screen, no blocking console error, no endless spinner.",
        "tier": "universal-must-pass",
        "surface_family": "all",
        "threshold": "HTTP 200; no visible text 'undefined' or 'null'; console error count = 0 (blocking level); spinner resolves within 10s",
        "measurement_method": "Playwright: assert response.status() === 200; assert no blocking console errors; screenshot shows non-blank content within 10s",
        "evidence_type": "screenshot + console-log",
        "failure_mode": "critical",
        "owner": "platform-owner",
        "source": "ops/verification-matrix.md smoke checks"
      },
      {
        "id": "U3",
        "name": "correct-child-context",
        "description": "The route clearly shows the right child theme, data, and copy — not another child's view or a blank template.",
        "tier": "universal-must-pass",
        "surface_family": "all",
        "threshold": "Child name or avatar visible; theme matches child (Sparkle Kingdom for JJ, Wolfdome for Buggsy); no wrong-child data visible",
        "measurement_method": "Screenshot inspection; assert child-specific CSS class (e.g. sparkle-body or wolfdome-body) present in DOM",
        "evidence_type": "screenshot",
        "failure_mode": "critical",
        "owner": "education-owner",
        "source": "ops/themes/palettes.md; KidsHub.html child-context logic"
      },
      {
        "id": "U4",
        "name": "core-loop-starts-fast",
        "description": "The child can begin the intended action within 2 interactions and about 5 seconds of orientation.",
        "tier": "universal-must-pass",
        "surface_family": "all",
        "threshold": "≤2 taps/clicks to reach the first interactive state AND child can begin action within ~5s of route ready",
        "measurement_method": "Manual walkthrough: count interactions from route-ready to first intentional child action. Playwright trace for automated timing (requires instrumentation #360).",
        "evidence_type": "video + screenshot",
        "failure_mode": "critical",
        "owner": "education-owner",
        "source": "ADHD accommodation standards; child UX research — attention span 5-7s for task onset"
      },
      {
        "id": "U5",
        "name": "core-loop-completes",
        "description": "One real task, mission, lesson, or draft can be completed end-to-end.",
        "tier": "universal-must-pass",
        "surface_family": "all",
        "threshold": "At least one full task cycle completes without error, freeze, or corruption",
        "measurement_method": "Manual walkthrough: complete one full task cycle (answer a question, finish a mission, save a comic panel, etc.). Playwright click sequence for automation.",
        "evidence_type": "video + screenshot",
        "failure_mode": "critical",
        "owner": "education-owner",
        "source": "MVSS v1 play gate flow step 5"
      },
      {
        "id": "U6",
        "name": "save-reload-holds",
        "description": "Progress, draft, submission, or completion state survives reload or resume when the surface promises it.",
        "tier": "universal-must-pass",
        "surface_family": "all",
        "threshold": "After completing an action, reload the route — the completed state is visible. Applies only to surfaces with persistence_contract = 'submitted' or 'draft' in ops/surface-map.md.",
        "measurement_method": "Complete action, reload URL, assert state is preserved. Ephemeral surfaces (persistence_contract = 'ephemeral') are exempt from this criterion.",
        "evidence_type": "screenshot-before-reload + screenshot-after-reload",
        "failure_mode": "critical",
        "owner": "education-owner",
        "source": "ops/surface-map.md persistence_contract column"
      },
      {
        "id": "U7",
        "name": "no-silent-failure",
        "description": "Missing data, audio, or backend responses show an explicit fallback state instead of doing nothing.",
        "tier": "universal-must-pass",
        "surface_family": "all",
        "threshold": "Introduce a simulated failure (bad data, slow response). Assert a visible fallback element is shown — not a blank, not an un-handled console error.",
        "measurement_method": "Playwright: intercept the API call and return error response; assert a fallback element is rendered in the surface HTML. grep for withFailureHandler(function(){}) as a pre-check (PRE-2).",
        "evidence_type": "screenshot + console-log",
        "failure_mode": "critical",
        "owner": "education-owner",
        "source": "MVSS v1 blocker issues #355 (JJHome), #356 (ComicStudio)"
      },
      {
        "id": "U8",
        "name": "feedback-understandable",
        "description": "Taps, clicks, answers, and saves produce visible or audible confirmation appropriate for the child's age.",
        "tier": "universal-must-pass",
        "surface_family": "all",
        "threshold": "Interactive element produces feedback within 500ms. Feedback is visible (color change, animation, message) or audible (sound effect). Silent completion is a failure.",
        "measurement_method": "Tap each interactive element type; assert visible state change within 500ms. Screenshot before-and-after.",
        "evidence_type": "screenshot-pair",
        "failure_mode": "critical",
        "owner": "education-owner",
        "source": "Child UX standards; WCAG 2.1 SC 4.1.3 Status Messages"
      },
      {
        "id": "U9",
        "name": "controls-fit-device",
        "description": "Buttons, cards, input fields, and drawing areas are reachable and usable on the target device.",
        "tier": "universal-must-pass",
        "surface_family": "all",
        "threshold": "Touch targets ≥44px on standard surfaces; ≥60px on JJ tablet (per prek-milestones.md:93). No controls are clipped or outside viewport.",
        "measurement_method": "Playwright: measure all interactive element bounding boxes at device viewport. Assert min-size thresholds per child profile.",
        "evidence_type": "screenshot + dom-measurement",
        "failure_mode": "critical",
        "owner": "education-owner",
        "source": "WCAG 2.2 SC 2.5.8 Target Size Minimum; prek-milestones.md:93"
      },
      {
        "id": "U10",
        "name": "no-dead-ends",
        "description": "The child can recover from an error, back out, continue, or finish without needing adult intervention.",
        "tier": "universal-must-pass",
        "surface_family": "all",
        "threshold": "From any non-entry state, the child can reach a known good state (back to hub, retry, or finish) without adult help.",
        "measurement_method": "Navigate to an error state or mid-task state; assert a recovery path (back button, retry CTA, or close action) is visible and functional.",
        "evidence_type": "screenshot + navigation-trace",
        "failure_mode": "critical",
        "owner": "education-owner",